{
  "$schema": "http://json-schema.org/draft-07/schema#",
  "$id": "https://tytus.traylinx.com/schema/app/v1.json",
  "title": "Tytus App Manifest v1",
  "description": "Schema for tytus-app.json — the contract between an app and the Tytus OS shell.",
  "type": "object",
  "required": ["id", "name", "version", "icon", "category", "description", "window", "permissions"],
  "additionalProperties": false,
  "properties": {
    "$schema": {
      "type": "string",
      "format": "uri"
    },
    "id": {
      "type": "string",
      "pattern": "^[a-z0-9-]+$",
      "minLength": 1,
      "maxLength": 64,
      "description": "App id; lowercase letters, digits, hyphens. Used as the registry primary key."
    },
    "name": {
      "type": "string",
      "minLength": 1,
      "maxLength": 64
    },
    "version": {
      "type": "string",
      "pattern": "^\\d+\\.\\d+\\.\\d+(?:-[0-9A-Za-z.-]+)?(?:\\+[0-9A-Za-z.-]+)?$",
      "description": "Semantic version (semver 2.0)."
    },
    "icon": {
      "type": "string",
      "minLength": 1,
      "maxLength": 64,
      "description": "Lucide icon name (e.g. Table2). The shell renders the matching icon."
    },
    "category": {
      "type": "string",
      "enum": [
        "System",
        "Internet",
        "Productivity",
        "Creative",
        "Games",
        "Utilities",
        "Media",
        "DevTools"
      ]
    },
    "description": {
      "type": "string",
      "minLength": 1,
      "maxLength": 256
    },
    "kind": {
      "type": "string",
      "enum": ["bundled", "installed", "legacy", "alias"]
    },
    "window": {
      "type": "object",
      "required": ["defaultSize", "minSize"],
      "additionalProperties": false,
      "properties": {
        "defaultSize": { "$ref": "#/$defs/size" },
        "minSize": { "$ref": "#/$defs/size" },
        "maxSize": { "$ref": "#/$defs/size" }
      }
    },
    "permissions": {
      "type": "array",
      "items": { "$ref": "#/$defs/permission" },
      "uniqueItems": true
    },
    "storage": {
      "type": "object",
      "additionalProperties": false,
      "properties": {
        "tables": {
          "type": "array",
          "items": {
            "type": "object",
            "required": ["name", "schema"],
            "additionalProperties": false,
            "properties": {
              "name": {
                "type": "string",
                "pattern": "^[a-z][a-z0-9_]*$",
                "description": "Logical table name; physical name is `app_<sqlAppId>_<name>`."
              },
              "schema": {
                "type": "string",
                "minLength": 1,
                "description": "Path to the migration SQL file, relative to the manifest."
              }
            }
          }
        },
        "shares": {
          "type": "object",
          "additionalProperties": {
            "type": "string",
            "pattern": "^app_[a-z][a-z0-9_]*$"
          },
          "description": "Map of share-key to physical table name owned by this app."
        }
      }
    },
    "entry": {
      "type": "object",
      "additionalProperties": false,
      "oneOf": [
        { "required": ["module"], "not": { "required": ["url"] } },
        { "required": ["url"], "not": { "required": ["module"] } }
      ],
      "properties": {
        "module": {
          "type": "string",
          "minLength": 1,
          "description": "Path to the ESM entry module, relative to the manifest. Used for bundled / workspace-package apps. Mutually exclusive with `url`."
        },
        "url": {
          "type": "string",
          "format": "uri",
          "pattern": "^https://",
          "minLength": 1,
          "description": "Fully-qualified https:// URL to a remote ESM module (e.g. jsDelivr / GitHub Pages chunk). Used for installed apps. Mutually exclusive with `module`."
        },
        "assets": {
          "type": "string",
          "minLength": 1,
          "description": "Bundle root for host.assets.* resolution. Defaults to ./assets/ next to module."
        },
        "css": {
          "type": "string",
          "minLength": 1,
          "description": "Optional CSS file. Loader fetches, transforms for isolation, and injects inline."
        },
        "i18n": {
          "type": "object",
          "additionalProperties": { "type": "string", "minLength": 1 }
        },
        "fonts": {
          "type": "array",
          "items": { "type": "string", "minLength": 1 },
          "uniqueItems": true,
          "description": "Font URLs to preload before app code runs. @font-face inside app CSS is REJECTED — declare fonts here."
        }
      }
    },
    "contributes": {
      "type": "object",
      "additionalProperties": false,
      "properties": {
        "fileAssociations": {
          "type": "array",
          "items": {
            "type": "object",
            "required": ["extension", "mimeType"],
            "additionalProperties": false,
            "properties": {
              "extension": {
                "type": "string",
                "pattern": "^\\.[a-zA-Z0-9.-]+$"
              },
              "mimeType": {
                "type": "string",
                "pattern": "^[a-zA-Z0-9.+-]+/[a-zA-Z0-9.+-]+$"
              }
            }
          },
          "uniqueItems": true
        },
        "agentSkills": {
          "type": "array",
          "items": {
            "type": "object",
            "required": ["id", "title", "description", "driver"],
            "additionalProperties": false,
            "properties": {
              "id": {
                "type": "string",
                "pattern": "^[a-z0-9][a-z0-9.-]*[a-z0-9]$",
                "maxLength": 96
              },
              "title": {
                "type": "string",
                "minLength": 1,
                "maxLength": 80
              },
              "description": {
                "type": "string",
                "minLength": 1,
                "maxLength": 240
              },
              "driver": {
                "type": "string",
                "enum": ["tytus-app", "host-api", "local-job", "terminal", "mcp", "browser"]
              },
              "skillUrl": {
                "type": "string",
                "minLength": 1,
                "maxLength": 512
              },
              "permissions": {
                "type": "array",
                "items": { "type": "string", "minLength": 1 },
                "uniqueItems": true
              },
              "triggers": {
                "type": "array",
                "items": { "type": "string", "minLength": 1, "maxLength": 64 },
                "uniqueItems": true
              }
            }
          },
          "uniqueItems": true
        }
      }
    },
    "aliasOf": {
      "type": "string",
      "pattern": "^[a-z0-9-]+$",
      "description": "Required when kind=alias. Live app id this alias resolves to."
    },
    "rewriteArgs": {
      "description": "Structured rewrite descriptor — NOT a serialized function. The registry maps this to a target WindowArgs at resolve time.",
      "oneOf": [
        {
          "type": "object",
          "required": ["type"],
          "additionalProperties": false,
          "properties": { "type": { "const": "identity" } }
        },
        {
          "type": "object",
          "required": ["type", "mode"],
          "additionalProperties": false,
          "properties": {
            "type": { "const": "studio" },
            "mode": { "enum": ["code", "text", "markdown", "json"] },
            "readOnly": { "type": "boolean" }
          }
        },
        {
          "type": "object",
          "required": ["type"],
          "additionalProperties": false,
          "properties": {
            "type": { "const": "sheet" },
            "readOnly": { "type": "boolean" }
          }
        },
        {
          "type": "object",
          "required": ["type"],
          "additionalProperties": false,
          "properties": {
            "type": { "const": "memo" },
            "readOnly": { "type": "boolean" }
          }
        },
        {
          "type": "object",
          "required": ["type", "args"],
          "additionalProperties": false,
          "properties": {
            "type": { "const": "static" },
            "args": { "type": "object" }
          }
        }
      ]
    },
    "removeInVersion": {
      "type": "string",
      "pattern": "^\\d+\\.\\d+\\.\\d+(?:-[0-9A-Za-z.-]+)?$",
      "description": "Future Tytus version that drops this alias entirely."
    },
    "hidden": {
      "type": "boolean"
    }
  },
  "allOf": [
    {
      "if": { "properties": { "kind": { "const": "alias" } }, "required": ["kind"] },
      "then": { "required": ["aliasOf", "removeInVersion"] },
      "else": { "required": ["entry"] }
    }
  ],
  "$defs": {
    "size": {
      "type": "object",
      "required": ["width", "height"],
      "additionalProperties": false,
      "properties": {
        "width": { "type": "integer", "minimum": 80, "maximum": 8192 },
        "height": { "type": "integer", "minimum": 80, "maximum": 8192 }
      }
    },
    "permission": {
      "anyOf": [
        {
          "type": "string",
          "enum": [
            "daemon.read",
            "daemon.network",
            "vfs.user.music",
            "vfs.user.documents",
            "vfs.user.desktop",
            "vfs.user.downloads",
            "vfs.user.pictures",
            "vfs.system",
            "shell.openWindow",
            "shell.notifications",
            "shell.menu",
            "shell.dock",
            "storage.app",
            "ai.chat",
            "ai.memory.read",
            "ai.memory.write",
            "ai.artifacts",
            "media.microphone",
            "media.display",
            "clipboard",
            "brain.read",
            "brain.append"
          ]
        },
        {
          "type": "string",
          "pattern": "^storage\\.shared\\.[a-z][a-z0-9_]*$"
        }
      ]
    }
  }
}
